﻿<?xml version="1.0" encoding="UTF-8" ?>
 <!-- Ejemplo: PR05-001.xml --> 
<catalogo 
 xmlns:xsi="http://www.w3.org/2001/XMLSchema-instance"
 xsi:noNamespaceSchemaLocation="05-001.xsd">
	<libro>
		<titulo>Manual Imprescindible de C/C++</titulo>
		<isbn>9788441526143</isbn>
		<autores>
			<autor>Miguel Angel Acera Garcia</autor>
		</autores>
		<paginas>416</paginas>
		<editorial>Anaya Multimedia</editorial>
	</libro>
	<libro>
		<titulo>Redes locales</titulo>
		<isbn>9788441519800</isbn>
		<autores>
			<autor>Jim Doherty</autor>
			<autor>Neil Anderson</autor>
		</autores>
		<paginas>544</paginas>
		<editorial>Anaya Multimedia</editorial>
	</libro>
</catalogo>
